{"$schema":"https://json-schema.org/draft/2020-12/schema","$id":"https://agentic-loop.dev/schemas/task-state-v1.json","type":"object","additionalProperties":false,"required":["schema_version","id","kind","task_id","status","dependencies","outcome","non_goals","actor","input_refs","input_hash","output_refs","output_hash","owner","next_owner","retry_budget","release_eligible","transitions"],"properties":{"schema_version":{"const":"v1"},"id":{"type":"string","pattern":"^ts-v2-[0-9]{3}$"},"kind":{"const":"canonical-task-state"},"task_id":{"type":"string","pattern":"^V2-[0-9]{3}$"},"status":{"enum":["queued","running","blocked","complete","failed"]},"dependencies":{"type":"array","items":{"type":"string","pattern":"^V2-[0-9]{3}$"}},"repair_of":{"type":"array","minItems":1,"items":{"type":"string","pattern":"^V2-[0-9]{3}$"}},"outcome":{"type":"string","minLength":1},"non_goals":{"type":"array","minItems":1,"items":{"type":"string","minLength":1}},"actor":{"enum":["sol","terra","luna"]},"input_refs":{"type":"array","items":{"type":"string","minLength":1}},"input_hash":{"type":"string","pattern":"^[a-f0-9]{64}$"},"output_refs":{"type":"array","items":{"type":"string","minLength":1}},"output_hash":{"type":"string","pattern":"^[a-f0-9]{64}$"},"owner":{"enum":["sol","terra","luna"]},"next_owner":{"type":["string","null"],"enum":["sol","terra","luna",null]},"block_reason":{"type":"string","minLength":1},"retry_budget":{"$ref":"task-state-retry.json"},"release_eligible":{"const":false},"transitions":{"type":"array","minItems":1,"items":{"$ref":"task-state-transition.json"}}}}
