{"schema_version":"v1","id":"ts-v2-033","kind":"canonical-task-state","task_id":"V2-033","status":"blocked","dependencies":["V2-026"],"outcome":"Fix every self-update design decision: signed Runner bundle, independent Bootstrapper, module version manifest, schema expand-coexist-migrate-contract, old binary GC, and the rollback window.","non_goals":["Do not design signing keys into the repository","Do not include the Stable recovery path in the self-update target"],"actor":"sol","input_refs":["V2-033","V2-026"],"input_hash":"beebfa5a345d198f41567bc3bae8a8d6cc92aa46e977806c3da855ef0e19296a","output_refs":["V2-033"],"output_hash":"128e0224571700121c7dad4ec06248d1bce37761b91ddb3d8a26da29aaf40565","owner":"terra","next_owner":"terra","block_reason":"V2-026","retry_budget":{"max_attempts":2,"attempts_used":0,"remaining":2},"release_eligible":false,"transitions":[{"sequence":1,"at":"2026-08-24T10:32:20Z","from_status":null,"to_status":"blocked","actor":"sol","input_refs":["V2-033","V2-026"],"input_hash":"beebfa5a345d198f41567bc3bae8a8d6cc92aa46e977806c3da855ef0e19296a","output_refs":["V2-033"],"output_hash":"128e0224571700121c7dad4ec06248d1bce37761b91ddb3d8a26da29aaf40565","owner":"terra","next_owner":"terra","retry_budget":{"max_attempts":2,"attempts_used":0,"remaining":2},"reason":"enqueued by Sol for the M8 design boundary"}]}