{"schema_version":"v1","id":"ts-v2-013","kind":"canonical-task-state","task_id":"V2-013","status":"complete","dependencies":["V2-011","V2-012"],"outcome":"Complete the local-closure Control Plane verification: Firestore emulator integration, budget guard tests, and OpenTofu validate without apply.","non_goals":["Do not run tofu apply","Do not report emulator success as real Firestore verification","Do not place credentials into fixtures or logs"],"actor":"luna","input_refs":["V2-013","V2-011","V2-012","wo-v2-013"],"input_hash":"1052bb335d0f32b704048734d6aa14d37cdfbd49150d87fed92a524e72579f82","output_refs":["V2-013","ev-v2-013-infra-plan"],"output_hash":"b1f56b04b04a7fd3bba2f36e0c203a913d4efa91b2ca890a54fba8bf184a2905","owner":"luna","next_owner":null,"retry_budget":{"max_attempts":2,"attempts_used":1,"remaining":1},"release_eligible":false,"transitions":[{"sequence":1,"at":"2026-08-24T10:32:20Z","from_status":null,"to_status":"blocked","actor":"sol","input_refs":["V2-013","V2-011","V2-012"],"input_hash":"4f42b550e0562ce8ad903270d98ee7249e74070c136f78639c5f61b1545e6736","output_refs":["V2-013"],"output_hash":"aae6ee2fbe59afa75a42f775cd4176beb6c3e9acf12c7e335a1622b8a2d00be3","owner":"luna","next_owner":"luna","retry_budget":{"max_attempts":2,"attempts_used":0,"remaining":2},"reason":"enqueued by Sol for the M2 local closure"},{"sequence":2,"at":"2026-08-24T12:48:13Z","from_status":"blocked","to_status":"queued","actor":"sol","input_refs":["V2-013","V2-011","V2-012","wo-v2-013"],"input_hash":"1052bb335d0f32b704048734d6aa14d37cdfbd49150d87fed92a524e72579f82","output_refs":["V2-013"],"output_hash":"aae6ee2fbe59afa75a42f775cd4176beb6c3e9acf12c7e335a1622b8a2d00be3","owner":"luna","next_owner":"luna","retry_budget":{"max_attempts":2,"attempts_used":0,"remaining":2},"reason":"M1 gate passed and the M2 design is fixed; the local-closure Control Plane work is queued for Luna"},{"sequence":3,"at":"2026-08-24T13:39:21Z","from_status":"queued","to_status":"running","actor":"luna","input_refs":["V2-013","V2-011","V2-012","wo-v2-013"],"input_hash":"1052bb335d0f32b704048734d6aa14d37cdfbd49150d87fed92a524e72579f82","output_refs":["V2-013"],"output_hash":"aae6ee2fbe59afa75a42f775cd4176beb6c3e9acf12c7e335a1622b8a2d00be3","owner":"luna","next_owner":"luna","retry_budget":{"max_attempts":2,"attempts_used":1,"remaining":1},"reason":"Luna implementing the local closure of the Control Plane"},{"sequence":4,"at":"2026-08-24T13:39:21Z","from_status":"running","to_status":"complete","actor":"luna","input_refs":["V2-013","V2-011","V2-012","wo-v2-013"],"input_hash":"1052bb335d0f32b704048734d6aa14d37cdfbd49150d87fed92a524e72579f82","output_refs":["V2-013","ev-v2-013-infra-plan"],"output_hash":"b1f56b04b04a7fd3bba2f36e0c203a913d4efa91b2ca890a54fba8bf184a2905","owner":"luna","next_owner":null,"retry_budget":{"max_attempts":2,"attempts_used":1,"remaining":1},"reason":"budget lowered to the free-tier fifty percent with a measured true-up, storage enforced as a level, quota exhaustion mapped to 429 quota_exhausted, preflight made machine-checkable, the infra policy assertions made fail-closed, and the three deploy workflow defects fixed"}]}