{
  "schema_version": "v1",
  "id": "ts-v2-022",
  "kind": "canonical-task-state",
  "task_id": "V2-022",
  "status": "blocked",
  "dependencies": [
    "V2-015",
    "V2-017",
    "V2-020",
    "V2-021",
    "V2-049",
    "V2-064",
    "V2-065",
    "V2-066",
    "V2-067",
    "V2-068",
    "V2-071"
  ],
  "outcome": "Dogfood this Foundation Repository as a Preview target, exercise every Release Contract capability live, and resume a Requirement on the previous Stable after breaking Preview.",
  "non_goals": [
    "Do not treat a candidate with an unexecutable capability as promotable",
    "Do not overwrite flaky evidence with a retry",
    "Do not create cost, notification, or public exposure outside declared test resources"
  ],
  "actor": "sol",
  "input_refs": [
    "V2-022",
    "V2-021",
    "V2-017",
    "V2-020",
    "V2-015",
    "V2-049"
  ],
  "input_hash": "fce8f00ce44416a729f17480d086a7a1deaad8ac0585f3464bdbca24f277142f",
  "output_refs": [
    "V2-022"
  ],
  "output_hash": "728c41e9ed86d8bf3e33828b72aaa381f8c43669c236c2c2e5d5964e80a515db",
  "owner": "luna",
  "next_owner": "luna",
  "retry_budget": {
    "max_attempts": 2,
    "attempts_used": 0,
    "remaining": 2
  },
  "release_eligible": false,
  "transitions": [
    {
      "sequence": 1,
      "at": "2026-08-24T10:32:20Z",
      "from_status": null,
      "to_status": "blocked",
      "actor": "sol",
      "input_refs": [
        "V2-022",
        "V2-021",
        "V2-017",
        "V2-020",
        "V2-015"
      ],
      "input_hash": "85dec20b03853ea714c2bcb393acea7a1964a287d7228b1f6765fd284234c1ee",
      "output_refs": [
        "V2-022"
      ],
      "output_hash": "728c41e9ed86d8bf3e33828b72aaa381f8c43669c236c2c2e5d5964e80a515db",
      "owner": "luna",
      "next_owner": "luna",
      "retry_budget": {
        "max_attempts": 2,
        "attempts_used": 0,
        "remaining": 2
      },
      "reason": "enqueued by Sol for the M5 live dogfood"
    },
    {
      "sequence": 2,
      "at": "2026-08-25T00:28:11Z",
      "from_status": "blocked",
      "to_status": "queued",
      "actor": "sol",
      "input_refs": [
        "V2-022",
        "V2-021",
        "V2-017",
        "V2-020",
        "V2-015",
        "V2-049"
      ],
      "input_hash": "fce8f00ce44416a729f17480d086a7a1deaad8ac0585f3464bdbca24f277142f",
      "output_refs": [
        "V2-022"
      ],
      "output_hash": "728c41e9ed86d8bf3e33828b72aaa381f8c43669c236c2c2e5d5964e80a515db",
      "owner": "terra",
      "next_owner": "terra",
      "retry_budget": {
        "max_attempts": 2,
        "attempts_used": 0,
        "remaining": 2
      },
      "reason": "every dependency is complete and the Preview environment is now the local grade, so the dogfood can run on the owner machine without a cloud project; Terra drafts the work order first"
    },
    {
      "sequence": 3,
      "at": "2026-08-25T02:20:01Z",
      "from_status": "queued",
      "to_status": "blocked",
      "actor": "sol",
      "input_refs": [
        "V2-022",
        "V2-021",
        "V2-017",
        "V2-020",
        "V2-015",
        "V2-049"
      ],
      "input_hash": "fce8f00ce44416a729f17480d086a7a1deaad8ac0585f3464bdbca24f277142f",
      "output_refs": [
        "V2-022"
      ],
      "output_hash": "728c41e9ed86d8bf3e33828b72aaa381f8c43669c236c2c2e5d5964e80a515db",
      "owner": "luna",
      "next_owner": "luna",
      "retry_budget": {
        "max_attempts": 2,
        "attempts_used": 0,
        "remaining": 2
      },
      "reason": "the dogfood must not be run against a tree where nine of the twelve capabilities are known to be unexercisable and five have no implementation; running it first would produce a knowingly partial record and force the exercise harness to be rewritten, so the five missing surfaces land first"
    }
  ],
  "block_reason": "V2-065,V2-066,V2-067,V2-068,V2-071"
}
