{"schema_version":"v1","id":"ts-v2-061","kind":"canonical-task-state","task_id":"V2-061","status":"complete","dependencies":["V2-053"],"outcome":"Correct the milestone condition that asks for something a local exercise cannot produce, and state how freshness is measured for a synthesised component.","non_goals":["Do not weaken the requirement that the digest path fails closed without credentials","Do not remove the digest requirement; move it to the gate that can honestly witness it"],"actor":"luna","input_refs":["V2-061","V2-053"],"input_hash":"3e90b9aaee5ed1f4b265d1571463d8c6eb5a695503d0a9d52ab6ceea000ca21c","output_refs":["V2-061"],"output_hash":"3fef8b5b4ed8816dc800b730cf517a57a506c93d4976efe515ff84868da8a943","owner":"luna","next_owner":null,"retry_budget":{"max_attempts":2,"attempts_used":1,"remaining":1},"release_eligible":false,"transitions":[{"sequence":1,"at":"2026-08-25T00:22:09Z","from_status":null,"to_status":"queued","actor":"sol","input_refs":["V2-061","V2-053"],"input_hash":"3e90b9aaee5ed1f4b265d1571463d8c6eb5a695503d0a9d52ab6ceea000ca21c","output_refs":["V2-061"],"output_hash":"3fef8b5b4ed8816dc800b730cf517a57a506c93d4976efe515ff84868da8a943","owner":"luna","next_owner":"luna","retry_budget":{"max_attempts":2,"attempts_used":0,"remaining":2},"reason":"the rewritten condition asks the local exercise to generate an approved plan digest, but a real plan always reaches the cloud API, so the condition as written cannot be met where it was placed"},{"sequence":2,"at":"2026-08-25T00:22:49Z","from_status":"queued","to_status":"running","actor":"luna","input_refs":["V2-061","V2-053"],"input_hash":"3e90b9aaee5ed1f4b265d1571463d8c6eb5a695503d0a9d52ab6ceea000ca21c","output_refs":["V2-061"],"output_hash":"3fef8b5b4ed8816dc800b730cf517a57a506c93d4976efe515ff84868da8a943","owner":"luna","next_owner":"luna","retry_budget":{"max_attempts":2,"attempts_used":1,"remaining":1},"reason":"correcting the condition that a local exercise cannot witness"},{"sequence":3,"at":"2026-08-25T00:22:49Z","from_status":"running","to_status":"complete","actor":"luna","input_refs":["V2-061","V2-053"],"input_hash":"3e90b9aaee5ed1f4b265d1571463d8c6eb5a695503d0a9d52ab6ceea000ca21c","output_refs":["V2-061"],"output_hash":"3fef8b5b4ed8816dc800b730cf517a57a506c93d4976efe515ff84868da8a943","owner":"luna","next_owner":null,"retry_budget":{"max_attempts":2,"attempts_used":1,"remaining":1},"reason":"the plan digest generation moved to the gate that can witness it while the fail-closed requirement stayed with the local milestone, and the freshness rule for a synthesised component key is now written down"}]}