{"schema_version":"v1","id":"ts-v2-049","kind":"canonical-task-state","task_id":"V2-049","status":"complete","dependencies":["V2-011"],"outcome":"Align the domain failure taxonomy with the documented one by adding the three missing failure classes, and keep the provider-local taxonomy distinct from it.","non_goals":["Do not change any transition function or any other domain behaviour","Do not merge the provider-local failure taxonomy into the domain one","Do not remove or rename an existing failure class"],"actor":"luna","input_refs":["V2-049","V2-011","wo-v2-049"],"input_hash":"8edfe2df721134cc93635229f27f12ee7a6c69b841ed7df7e50b5242a4553e20","output_refs":["V2-049","ev-v2-049-failure-taxonomy"],"output_hash":"6f8e0d253fb3e91e5a7ce62b5e8785228bd95bdde548ed8c928c4d9cd6ecbdf9","owner":"luna","next_owner":null,"retry_budget":{"max_attempts":2,"attempts_used":1,"remaining":1},"release_eligible":false,"transitions":[{"sequence":1,"at":"2026-08-24T15:02:41Z","from_status":null,"to_status":"queued","actor":"sol","input_refs":["V2-049","V2-011"],"input_hash":"c6f1a073dc0273f3baaa1700aa046145037215064ff36726801cc5c0c1aa420d","output_refs":["V2-049"],"output_hash":"4f70deb790de356ffa97175d4a7d0028a04e79f8542cca585eab15ecea18ff7c","owner":"luna","next_owner":"luna","retry_budget":{"max_attempts":2,"attempts_used":0,"remaining":2},"reason":"three documented failure classes have no domain constant and the M4 enumeration would otherwise defer them to no owner"},{"sequence":2,"at":"2026-08-24T23:06:28Z","from_status":"queued","to_status":"running","actor":"luna","input_refs":["V2-049","V2-011","wo-v2-049"],"input_hash":"8edfe2df721134cc93635229f27f12ee7a6c69b841ed7df7e50b5242a4553e20","output_refs":["V2-049"],"output_hash":"4f70deb790de356ffa97175d4a7d0028a04e79f8542cca585eab15ecea18ff7c","owner":"luna","next_owner":"luna","retry_budget":{"max_attempts":2,"attempts_used":1,"remaining":1},"reason":"Luna closing the taxonomy drift"},{"sequence":3,"at":"2026-08-24T23:06:28Z","from_status":"running","to_status":"complete","actor":"luna","input_refs":["V2-049","V2-011","wo-v2-049"],"input_hash":"8edfe2df721134cc93635229f27f12ee7a6c69b841ed7df7e50b5242a4553e20","output_refs":["V2-049","ev-v2-049-failure-taxonomy"],"output_hash":"6f8e0d253fb3e91e5a7ce62b5e8785228bd95bdde548ed8c928c4d9cd6ecbdf9","owner":"luna","next_owner":null,"retry_budget":{"max_attempts":2,"attempts_used":1,"remaining":1},"reason":"the domain taxonomy now declares all seventeen documented failure classes, the enumeration test witnesses the agreement instead of the drift and fails to compile if a constant is removed, and the provider-local taxonomy is asserted to remain a distinct type"}]}