{"schema_version":"v1","id":"ts-v2-045","kind":"canonical-task-state","task_id":"V2-045","status":"complete","dependencies":["V2-016","V2-017"],"outcome":"Make the component dependency DAG match real imports and make the evidence key actually cover the dependency surface.","non_goals":["Do not redesign component boundaries","Do not change the affected-closure selection logic","Do not run before V2-016 and V2-017 have landed, because it invalidates every active component evidence"],"actor":"luna","input_refs":["wo-v2-045","dp-v2-045"],"input_hash":"92307dc6f01a7b51a50663877b95a7f27e423bb71a23c76813860552ee19ae97","output_refs":["ev-v2-045-api","ev-v2-045-application","ev-v2-045-candidate-aggregate","ev-v2-045-ci","ev-v2-045-contracts","ev-v2-045-control-plane","ev-v2-045-docs","ev-v2-045-domain","ev-v2-045-environment","ev-v2-045-infra","ev-v2-045-internal-contracts","ev-v2-045-legacy-import","ev-v2-045-provider","ev-v2-045-reconciler","ev-v2-045-release","ev-v2-045-repository-meta","ev-v2-045-runner","ev-v2-045-scheduler","ev-v2-045-store-firestore","ev-v2-045-store-memory","ev-v2-045-task-ledger","ev-v2-045-tooling","ev-v2-045-update","ev-v2-045-web"],"output_hash":"06d528d94ecee624f7d7d1aa87cc37aaa6397e3752db4f60891127f3a2c920e8","owner":"luna","next_owner":null,"retry_budget":{"max_attempts":2,"attempts_used":1,"remaining":1},"release_eligible":false,"transitions":[{"sequence":1,"at":"2026-08-24T13:10:03Z","from_status":null,"to_status":"blocked","actor":"sol","input_refs":["V2-045","V2-016","V2-017"],"input_hash":"c5817ed13c5f19cf7b901eb6d628dc314182f4f898faa249729ddb192433fd79","output_refs":["V2-045"],"output_hash":"3d2ec6b07f544b640d0a11804d0599af913fdbed55fb62427e513e80e262a721","owner":"terra","next_owner":"terra","retry_budget":{"max_attempts":2,"attempts_used":0,"remaining":2},"reason":"the declared runner dependencies omit internal/application and, because depended-on components declare no public contracts, the evidence key does not move when a dependency changes"},{"sequence":2,"at":"2026-08-25T00:27:33Z","from_status":"blocked","to_status":"queued","actor":"sol","input_refs":["V2-045","V2-016","V2-017"],"input_hash":"c5817ed13c5f19cf7b901eb6d628dc314182f4f898faa249729ddb192433fd79","output_refs":["V2-045"],"output_hash":"3d2ec6b07f544b640d0a11804d0599af913fdbed55fb62427e513e80e262a721","owner":"terra","next_owner":"terra","retry_budget":{"max_attempts":2,"attempts_used":0,"remaining":2},"reason":"V2-016 and V2-017 have both landed, so the dependency manifest and evidence key correction can run immediately before the M3 gate where its full re-issue rides along"},{"sequence":3,"at":"2026-08-25T01:53:00Z","from_status":"queued","to_status":"running","actor":"luna","input_refs":["wo-v2-045","dp-v2-045"],"input_hash":"92307dc6f01a7b51a50663877b95a7f27e423bb71a23c76813860552ee19ae97","output_refs":["V2-045"],"output_hash":"3d2ec6b07f544b640d0a11804d0599af913fdbed55fb62427e513e80e262a721","owner":"luna","next_owner":"luna","retry_budget":{"max_attempts":2,"attempts_used":1,"remaining":1},"reason":"wo-v2-045\u306b\u57fa\u3065\u304d\u7740\u624b\u3002\u4f9d\u5b58\u5148Roots\u306e\u63a8\u79fb\u9589\u5305\u3092hash\u3059\u308b\u65b0evidenceKey\u3001verification_dependencies field\u3001AST\u6b63\u672c\u306emanifest\u88ab\u8986test\uff08PC1\u301cPC6\uff09\u300123 component+aggregate\u306e\u518d\u767a\u884c\u30922-commit protocol\u3067\u884c\u3046"},{"sequence":4,"at":"2026-08-25T02:21:20Z","from_status":"running","to_status":"complete","actor":"luna","input_refs":["wo-v2-045","dp-v2-045"],"input_hash":"92307dc6f01a7b51a50663877b95a7f27e423bb71a23c76813860552ee19ae97","output_refs":["ev-v2-045-api","ev-v2-045-application","ev-v2-045-candidate-aggregate","ev-v2-045-ci","ev-v2-045-contracts","ev-v2-045-control-plane","ev-v2-045-docs","ev-v2-045-domain","ev-v2-045-environment","ev-v2-045-infra","ev-v2-045-internal-contracts","ev-v2-045-legacy-import","ev-v2-045-provider","ev-v2-045-reconciler","ev-v2-045-release","ev-v2-045-repository-meta","ev-v2-045-runner","ev-v2-045-scheduler","ev-v2-045-store-firestore","ev-v2-045-store-memory","ev-v2-045-task-ledger","ev-v2-045-tooling","ev-v2-045-update","ev-v2-045-web"],"output_hash":"06d528d94ecee624f7d7d1aa87cc37aaa6397e3752db4f60891127f3a2c920e8","owner":"luna","next_owner":null,"retry_budget":{"max_attempts":2,"attempts_used":1,"remaining":1},"reason":"evidenceKey\u3092\u4f9d\u5b58\u5148Roots\u306e\u63a8\u79fb\u9589\u5305\u3078\u5909\u66f4\u3057\u300123 component\u306e\u5ba3\u8a00dependencies\u3092\u5b9fimport\u3078\u662f\u6b63\u3057\u3001verification_dependencies\u306e\u65b0field\u3067test\u7531\u6765\u306e\u5b9f\u5faa\u74b0\u3092\u53ce\u5bb9\u3057\u305f\u30021 byte probe\u3067key\u304c\u52d5\u304fcomponent\u306f1/23\u304b\u30897/23\u3078\u3001Makefile probe\u3067\u306f1/23\u304b\u308923/23\u3078\u5897\u3048\u305f\u3002framing\u306e\u5b9f\u5728\u3059\u308b\u66d6\u6627\u6027\uff08path bytes\u306e\u76f4\u5f8c\u306b\u5185\u5bb9bytes\u3092\u66f8\u304f\u305f\u3081(a,bc)\u3068(ab,c)\u304c\u540c\u4e00hash\u306b\u306a\u308b\uff09\u3092\u65e7\u7b97\u6cd5\u3067\u518d\u73fe\u3057\u3066\u4fee\u6b63\u3057\u305f\u3002\u5ba3\u8a00\u3068\u5b9fimport graph\u3092\u7a81\u304d\u5408\u308f\u305b\u308b3\u691c\u67fb\u3092PC1\u301cPC6\u306epositive control\u4ed8\u304d\u3067\u6052\u4e45\u5316\u3057\u305f\u300224 record\u306ekey\u306fcommit A\u6642\u70b9\u306e\u5024\u3067\u3042\u308a\u3001\u5f8c\u7d9atask\u304c\u7740\u5730\u3057\u305ftip\u3067\u306f12\u4ef6\u304c\u65e2\u306b\u4e0d\u4e00\u81f4\u3067\u3042\u308b\u3002G6\u306f\u9bae\u5ea6\u3092gate\u6642\u306e\u518d\u767a\u884c\u3067\u6e80\u305f\u3059\u3068\u5b9a\u3081\u3066\u3044\u308b\u305f\u3081\u66f8\u304d\u63db\u3048\u305a\u3001\u5224\u5b9acommit\u3067\u306e\u518d\u767a\u884c\u306fV2-018\u306e\u4ed5\u4e8b\u3068\u3059\u308b"}]}