{"schema_version":"v1","id":"ts-v2-051","kind":"canonical-task-state","task_id":"V2-051","status":"queued","dependencies":["V2-013"],"outcome":"Run the candidate control plane as real processes on the owner machine against the Firestore emulator and the localhost interface, and record preview-local live evidence for the rewritten M2 conditions.","non_goals":["Do not create any Google Cloud resource","Do not judge the four conditions deferred to the initial deploy gate","Do not substitute fakes for the real processes"],"actor":"sol","input_refs":["V2-051","V2-013"],"input_hash":"de2d192a63dc476ed57041d61d3d45207002d26654062e140f283938c4b8b5be","output_refs":["V2-051"],"output_hash":"e3f135c6909de6f9475c36020bc2e4a9da4c8d6384a67adead97b0ca7bc997a1","owner":"luna","next_owner":"luna","retry_budget":{"max_attempts":2,"attempts_used":0,"remaining":2},"release_eligible":false,"transitions":[{"sequence":1,"at":"2026-08-24T23:09:08Z","from_status":null,"to_status":"queued","actor":"sol","input_refs":["V2-051","V2-013"],"input_hash":"de2d192a63dc476ed57041d61d3d45207002d26654062e140f283938c4b8b5be","output_refs":["V2-051"],"output_hash":"e3f135c6909de6f9475c36020bc2e4a9da4c8d6384a67adead97b0ca7bc997a1","owner":"luna","next_owner":"luna","retry_budget":{"max_attempts":2,"attempts_used":0,"remaining":2},"reason":"the owner declared that Preview verification runs locally, so M2 needs a live exercise at the preview-local grade rather than a cloud apply"}]}