{"schema_version":"v1","id":"ts-v2-018","kind":"canonical-task-state","task_id":"V2-018","status":"blocked","dependencies":["V2-017","V2-045","V2-047","V2-048"],"outcome":"Judge the M3 gate.","non_goals":["Do not accept the fake Provider journey in place of representative Provider live evidence"],"actor":"sol","input_refs":["V2-018","V2-017"],"input_hash":"1c9874cbec8c8ef75ceac41f58c667097b05368dcebec5753c5a121486002d6e","output_refs":["V2-018"],"output_hash":"1b77544041891a6082c0e01654ae730a53fe1b63517d1526b3eb163137cb0090","owner":"sol","next_owner":"sol","block_reason":"V2-017,V2-045,V2-047,V2-048","retry_budget":{"max_attempts":1,"attempts_used":0,"remaining":1},"release_eligible":false,"transitions":[{"sequence":1,"at":"2026-08-24T10:32:20Z","from_status":null,"to_status":"blocked","actor":"sol","input_refs":["V2-018","V2-017"],"input_hash":"1c9874cbec8c8ef75ceac41f58c667097b05368dcebec5753c5a121486002d6e","output_refs":["V2-018"],"output_hash":"1b77544041891a6082c0e01654ae730a53fe1b63517d1526b3eb163137cb0090","owner":"sol","next_owner":"sol","retry_budget":{"max_attempts":1,"attempts_used":0,"remaining":1},"reason":"enqueued by Sol as the M3 gate"}]}