{"schema_version":"v1","id":"ts-v2-037","kind":"canonical-task-state","task_id":"V2-037","status":"blocked","dependencies":["V2-036"],"outcome":"Deliver the legacy one-time import tool and a human-reviewable dry run: read-only export normalization, secret scan quarantine list, disposition classification, and content digests.","non_goals":["Do not write to GitHub","Do not stop or drain the legacy Loop in this task","Do not import suspected secret content automatically"],"actor":"sol","input_refs":["V2-037","V2-036"],"input_hash":"8a17a466f3b0181b75098b85d511c67a55a538df5937893a13222bff8dccc6a3","output_refs":["V2-037"],"output_hash":"b63f3e95bfa81bcfbee7c6391871f5b0d610ae2c3c435512c63f217e23ae1323","owner":"luna","next_owner":"luna","block_reason":"V2-036","retry_budget":{"max_attempts":2,"attempts_used":0,"remaining":2},"release_eligible":false,"transitions":[{"sequence":1,"at":"2026-08-24T10:32:20Z","from_status":null,"to_status":"blocked","actor":"sol","input_refs":["V2-037","V2-036"],"input_hash":"8a17a466f3b0181b75098b85d511c67a55a538df5937893a13222bff8dccc6a3","output_refs":["V2-037"],"output_hash":"b63f3e95bfa81bcfbee7c6391871f5b0d610ae2c3c435512c63f217e23ae1323","owner":"luna","next_owner":"luna","retry_budget":{"max_attempts":2,"attempts_used":0,"remaining":2},"reason":"enqueued by Sol for the M9 dry run"}]}