{"schema_version":"v1","id":"ts-v2-060","kind":"canonical-task-state","task_id":"V2-060","status":"complete","dependencies":["V2-051","V2-052"],"outcome":"Re-issue the M2 evidence so both witnessed components bind to the judging tree, and record the machine identifier the environment grade requires.","non_goals":["Do not rewrite the earlier evidence records","Do not change any implementation; this is measurement and record only","Do not claim a plan digest that was never generated"],"actor":"sol","input_refs":["V2-060","V2-051","V2-052"],"input_hash":"5a340cd258f79a96292bb8750e7378da0cca100cc6b199bb60ea50cf1c107e87","output_refs":["V2-060","ev-v2-060-infra-plan-refresh","ev-v2-060-control-plane-local-live-refresh"],"output_hash":"6783d27b0ea3fa4cd156f6b6f2673986d5d62b48384c3013f044d514bf9326ce","owner":"sol","next_owner":null,"retry_budget":{"max_attempts":2,"attempts_used":1,"remaining":1},"release_eligible":false,"transitions":[{"sequence":1,"at":"2026-08-25T00:22:09Z","from_status":null,"to_status":"queued","actor":"sol","input_refs":["V2-060","V2-051","V2-052"],"input_hash":"5a340cd258f79a96292bb8750e7378da0cca100cc6b199bb60ea50cf1c107e87","output_refs":["V2-060"],"output_hash":"70659bf50160c08abbdd949994348ddb5540e17c115132daa890243c7d434548","owner":"sol","next_owner":"sol","retry_budget":{"max_attempts":2,"attempts_used":0,"remaining":2},"reason":"the infra record carries a key that matches no committed tree because it was measured in a working tree that was later rewritten, the composite local-live key went stale when a later task changed four of its five constituents, and the machine identifier the environment grade demands is absent"},{"sequence":2,"at":"2026-08-25T00:24:22Z","from_status":"queued","to_status":"running","actor":"sol","input_refs":["V2-060","V2-051","V2-052"],"input_hash":"5a340cd258f79a96292bb8750e7378da0cca100cc6b199bb60ea50cf1c107e87","output_refs":["V2-060"],"output_hash":"70659bf50160c08abbdd949994348ddb5540e17c115132daa890243c7d434548","owner":"sol","next_owner":"sol","retry_budget":{"max_attempts":2,"attempts_used":1,"remaining":1},"reason":"the coordinator re-measures both witnessed components at the judging tree"},{"sequence":3,"at":"2026-08-25T00:24:22Z","from_status":"running","to_status":"complete","actor":"sol","input_refs":["V2-060","V2-051","V2-052"],"input_hash":"5a340cd258f79a96292bb8750e7378da0cca100cc6b199bb60ea50cf1c107e87","output_refs":["V2-060","ev-v2-060-infra-plan-refresh","ev-v2-060-control-plane-local-live-refresh"],"output_hash":"6783d27b0ea3fa4cd156f6b6f2673986d5d62b48384c3013f044d514bf9326ce","owner":"sol","next_owner":null,"retry_budget":{"max_attempts":2,"attempts_used":1,"remaining":1},"reason":"both M2 witnesses now bind to the judging tree: the infra key that matched no committed tree is replaced by the value that has been correct throughout, the synthesised local-live key is recomputed by its declared method after a later task moved four of its five constituents, and the machine identifier the environment grade requires is recorded; the live exercise was re-executed with zero skips and the budget guard refused before the side effect again"}]}