{
  "schema_version": "v1",
  "id": "ts-v2-077",
  "kind": "canonical-task-state",
  "task_id": "V2-077",
  "status": "queued",
  "dependencies": [
    "V2-027"
  ],
  "outcome": "Make the invocation's declared working directory actually reach the child process, so a Provider that is not told the workspace on its command line does not run in whatever directory the Runner happened to be started from.",
  "non_goals": [
    "Do not remove a command-line directory flag that the CLI's own help declares",
    "Do not treat the mount namespace as a substitute for pointing the child at its workspace",
    "Do not widen what the child may reach in order to make the directory take effect"
  ],
  "actor": "sol",
  "input_refs": [
    "V2-027",
    "V2-077"
  ],
  "input_hash": "c6ea5f259486217ff91e99b85ff6fa0e7a20f5f52740e1ad130efcbd82964f1d",
  "output_refs": [
    "V2-077"
  ],
  "output_hash": "034d8f202d6694c098645b872ee09fc68155dfdabb94561ac20201ac0cb68f0b",
  "owner": "terra",
  "next_owner": "terra",
  "retry_budget": {
    "max_attempts": 2,
    "attempts_used": 0,
    "remaining": 2
  },
  "release_eligible": false,
  "transitions": [
    {
      "sequence": 1,
      "at": "2026-08-25T11:40:00Z",
      "from_status": null,
      "to_status": "queued",
      "actor": "sol",
      "input_refs": [
        "V2-027",
        "V2-077"
      ],
      "input_hash": "c6ea5f259486217ff91e99b85ff6fa0e7a20f5f52740e1ad130efcbd82964f1d",
      "output_refs": [
        "V2-077"
      ],
      "output_hash": "034d8f202d6694c098645b872ee09fc68155dfdabb94561ac20201ac0cb68f0b",
      "owner": "terra",
      "next_owner": "terra",
      "retry_budget": {
        "max_attempts": 2,
        "attempts_used": 0,
        "remaining": 2
      },
      "reason": "the adapter work measured that the invocation's WorkingDirectory is set by the adapter and read by nobody: the process supervisor never assigns the child's directory and the supervised invocation runner never reads the field, so for the two Providers whose command line carries a directory flag the flag is the only thing that tells the child where it is, and for the representative Provider, whose command line carries no path at all, the child runs in the directory the Runner was started from rather than the Increment's workspace"
    },
    {
      "sequence": 2,
      "at": "2026-08-25T11:40:01Z",
      "from_status": "queued",
      "to_status": "blocked",
      "actor": "sol",
      "input_refs": [
        "V2-027",
        "V2-077"
      ],
      "input_hash": "c6ea5f259486217ff91e99b85ff6fa0e7a20f5f52740e1ad130efcbd82964f1d",
      "output_refs": [
        "V2-077"
      ],
      "output_hash": "034d8f202d6694c098645b872ee09fc68155dfdabb94561ac20201ac0cb68f0b",
      "owner": "terra",
      "next_owner": "terra",
      "retry_budget": {
        "max_attempts": 2,
        "attempts_used": 0,
        "remaining": 2
      },
      "reason": "the measurement that names this defect lands with the task it depends on"
    },
    {
      "sequence": 3,
      "at": "2026-08-25T11:50:00Z",
      "from_status": "blocked",
      "to_status": "queued",
      "actor": "sol",
      "input_refs": [
        "V2-027",
        "V2-077"
      ],
      "input_hash": "c6ea5f259486217ff91e99b85ff6fa0e7a20f5f52740e1ad130efcbd82964f1d",
      "output_refs": [
        "V2-077"
      ],
      "output_hash": "034d8f202d6694c098645b872ee09fc68155dfdabb94561ac20201ac0cb68f0b",
      "owner": "terra",
      "next_owner": "terra",
      "retry_budget": {
        "max_attempts": 2,
        "attempts_used": 0,
        "remaining": 2
      },
      "reason": "every task this one depends on is complete, so the block has cleared"
    }
  ]
}
