{"schema_version":"v1","id":"ts-v2-050","kind":"canonical-task-state","task_id":"V2-050","status":"complete","dependencies":["V2-047"],"outcome":"Change the provider preflight's meaning from per-task billing approval to a runaway guard under the owner's standing authorization, and add the standing authorization contract with its ledger check.","non_goals":["Do not remove or rename any limits field","Do not weaken fail_closed or any of the nine refusal cases","Do not author the owner's standing authorization content"],"actor":"luna","input_refs":["V2-050","V2-047"],"input_hash":"48757d4de1e0b809e7ca19bfbab7d93f9ec3cd6609ca840d20df4803d3b9f689","output_refs":["V2-050","ev-v2-050-runaway-guard"],"output_hash":"f35c8f3f12b8c5d0ec0919052679c0ad5138d0f281c57e2767f44756d7abe896","owner":"luna","next_owner":null,"retry_budget":{"max_attempts":2,"attempts_used":1,"remaining":1},"release_eligible":false,"transitions":[{"sequence":1,"at":"2026-08-24T23:09:08Z","from_status":null,"to_status":"queued","actor":"sol","input_refs":["V2-050","V2-047"],"input_hash":"48757d4de1e0b809e7ca19bfbab7d93f9ec3cd6609ca840d20df4803d3b9f689","output_refs":["V2-050"],"output_hash":"a2e73fd23c376e8234afc9bb958485136dbeea1212f881102441c5d9c0ab1750","owner":"luna","next_owner":"luna","retry_budget":{"max_attempts":2,"attempts_used":0,"remaining":2},"reason":"the owner authorised free use of the contracted flat-rate subscriptions, so a per-task monetary approval is no longer the right instrument; the thresholds remain as runaway detection"},{"sequence":2,"at":"2026-08-24T23:20:20Z","from_status":"queued","to_status":"running","actor":"luna","input_refs":["V2-050","V2-047"],"input_hash":"48757d4de1e0b809e7ca19bfbab7d93f9ec3cd6609ca840d20df4803d3b9f689","output_refs":["V2-050"],"output_hash":"a2e73fd23c376e8234afc9bb958485136dbeea1212f881102441c5d9c0ab1750","owner":"luna","next_owner":"luna","retry_budget":{"max_attempts":2,"attempts_used":1,"remaining":1},"reason":"Luna reframing the preflight as a runaway guard"},{"sequence":3,"at":"2026-08-24T23:20:20Z","from_status":"running","to_status":"complete","actor":"luna","input_refs":["V2-050","V2-047"],"input_hash":"48757d4de1e0b809e7ca19bfbab7d93f9ec3cd6609ca840d20df4803d3b9f689","output_refs":["V2-050","ev-v2-050-runaway-guard"],"output_hash":"f35c8f3f12b8c5d0ec0919052679c0ad5138d0f281c57e2767f44756d7abe896","owner":"luna","next_owner":null,"retry_budget":{"max_attempts":2,"attempts_used":1,"remaining":1},"reason":"the preflight limits are documented as runaway-detection thresholds rather than budgets with the structure proven unchanged, and a standing authorization contract with five independent refusals now exists for the owner's one-time authorization"}]}