{"schema_version":"v1","id":"ts-v2-030","kind":"canonical-task-state","task_id":"V2-030","status":"queued","dependencies":["V2-020"],"outcome":"Complete multi-Runner and multi-Repository scheduling, resource claim conflict, dependency, starvation prevention, and cross-repository Increment rollback in local closure.","non_goals":["Do not treat single-machine processes as the multi-machine completion condition","Do not write to external repositories"],"actor":"sol","input_refs":["V2-030","V2-020"],"input_hash":"2d30167eeb2550dab8479b8893eaecb0f4d6535c84b7529768620c61e64163b1","output_refs":["V2-030"],"output_hash":"c99b74aed81e527ce84625dedc39621139e1ede62d45e1e4113ad7dee145f74e","owner":"terra","next_owner":"terra","retry_budget":{"max_attempts":2,"attempts_used":0,"remaining":2},"release_eligible":false,"transitions":[{"sequence":1,"at":"2026-08-24T10:32:20Z","from_status":null,"to_status":"blocked","actor":"sol","input_refs":["V2-030","V2-020"],"input_hash":"2d30167eeb2550dab8479b8893eaecb0f4d6535c84b7529768620c61e64163b1","output_refs":["V2-030"],"output_hash":"c99b74aed81e527ce84625dedc39621139e1ede62d45e1e4113ad7dee145f74e","owner":"luna","next_owner":"luna","retry_budget":{"max_attempts":2,"attempts_used":0,"remaining":2},"reason":"enqueued by Sol for the M7 local closure"},{"sequence":2,"at":"2026-08-24T23:48:01Z","from_status":"blocked","to_status":"queued","actor":"sol","input_refs":["V2-030","V2-020"],"input_hash":"2d30167eeb2550dab8479b8893eaecb0f4d6535c84b7529768620c61e64163b1","output_refs":["V2-030"],"output_hash":"c99b74aed81e527ce84625dedc39621139e1ede62d45e1e4113ad7dee145f74e","owner":"terra","next_owner":"terra","retry_budget":{"max_attempts":2,"attempts_used":0,"remaining":2},"reason":"the M4 gate passed, so the multi-runner and multi-repository scheduling work can start; Terra drafts the work order first"}]}