{"schema_version":"v1","id":"ts-v2-021","kind":"canonical-task-state","task_id":"V2-021","status":"blocked","dependencies":["V2-009","V2-011"],"outcome":"Complete the local-closure release pipeline: candidate bundle digest, promotion and rollback transitions, docs drift gate, Preview and Stable documentation routing, and Requirement completion.","non_goals":["Do not deploy or promote for real","Do not replace schema and link verification with AI document review"],"actor":"sol","input_refs":["V2-021","V2-009","V2-011"],"input_hash":"d03a87a75ea2d5b9fc8045391e3e28d2fd9c170cd263900bc1c3b957d59e62d8","output_refs":["V2-021"],"output_hash":"4d432ab7ecad3b40fcc915a19f651745a07a3a9360ef953b257f34e5ec1ec9ca","owner":"luna","next_owner":"luna","block_reason":"V2-009,V2-011","retry_budget":{"max_attempts":2,"attempts_used":0,"remaining":2},"release_eligible":false,"transitions":[{"sequence":1,"at":"2026-08-24T10:32:20Z","from_status":null,"to_status":"blocked","actor":"sol","input_refs":["V2-021","V2-009","V2-011"],"input_hash":"d03a87a75ea2d5b9fc8045391e3e28d2fd9c170cd263900bc1c3b957d59e62d8","output_refs":["V2-021"],"output_hash":"4d432ab7ecad3b40fcc915a19f651745a07a3a9360ef953b257f34e5ec1ec9ca","owner":"luna","next_owner":"luna","retry_budget":{"max_attempts":2,"attempts_used":0,"remaining":2},"reason":"enqueued by Sol for the M5 local closure"}]}