{"schema_version":"v1","id":"ts-v2-029","kind":"canonical-task-state","task_id":"V2-029","status":"blocked","dependencies":["V2-028"],"outcome":"Judge the M6 gate.","non_goals":["Do not treat two successful Providers as satisfying the three-Provider condition"],"actor":"sol","input_refs":["V2-029","V2-028"],"input_hash":"6946de1fbefe84c719f6dbee24f8bccda0b29bb6e1be1ef896e7dd5365be26e9","output_refs":["V2-029"],"output_hash":"076381f7b4cd745f56a51cf50ce1ae884f7fdf5b2cb906305cf7855ed1e5d0ba","owner":"sol","next_owner":"sol","block_reason":"V2-028","retry_budget":{"max_attempts":1,"attempts_used":0,"remaining":1},"release_eligible":false,"transitions":[{"sequence":1,"at":"2026-08-24T10:32:20Z","from_status":null,"to_status":"blocked","actor":"sol","input_refs":["V2-029","V2-028"],"input_hash":"6946de1fbefe84c719f6dbee24f8bccda0b29bb6e1be1ef896e7dd5365be26e9","output_refs":["V2-029"],"output_hash":"076381f7b4cd745f56a51cf50ce1ae884f7fdf5b2cb906305cf7855ed1e5d0ba","owner":"sol","next_owner":"sol","retry_budget":{"max_attempts":1,"attempts_used":0,"remaining":1},"reason":"enqueued by Sol as the M6 gate"}]}