{"schema_version":"v1","id":"ts-v2-043","kind":"canonical-task-state","task_id":"V2-043","status":"queued","dependencies":["V2-011"],"outcome":"Make the Increment lifecycle documentation match the implemented transition closure and correct the test-count prose in the M1 evidence.","non_goals":["Do not add Paused to IncrementStatus","Do not add a command that returns an Increment to Proposed","Do not change any non-test Go file under internal/domain","Do not change docs/product/user-facing-spec.md or docs/principles.md"],"actor":"sol","input_refs":["V2-043","V2-011","V2-010"],"input_hash":"eb6b085784918a29904bc00df3c2e86c48a15c3eb714348aff8d930097f257f8","output_refs":["V2-043"],"output_hash":"ab67ecfb81a50cf164a1cbff3287393fa6a82f1a5d4a24523b4b6606f0afd55f","owner":"luna","next_owner":"luna","retry_budget":{"max_attempts":2,"attempts_used":0,"remaining":2},"release_eligible":false,"transitions":[{"sequence":1,"at":"2026-08-24T12:48:52Z","from_status":null,"to_status":"queued","actor":"sol","input_refs":["V2-043","V2-011","V2-010"],"input_hash":"eb6b085784918a29904bc00df3c2e86c48a15c3eb714348aff8d930097f257f8","output_refs":["V2-043"],"output_hash":"ab67ecfb81a50cf164a1cbff3287393fa6a82f1a5d4a24523b4b6606f0afd55f","owner":"luna","next_owner":"luna","retry_budget":{"max_attempts":2,"attempts_used":0,"remaining":2},"reason":"M1 gate judgement ruled that the Increment lifecycle diagram must follow the implementation, not the reverse"}]}