{"schema_version":"v1","id":"ts-v2-057","kind":"canonical-task-state","task_id":"V2-057","status":"complete","dependencies":["V2-019"],"outcome":"Re-issue the reconciler component evidence at the judging tree so the freshness rule can bind, after V2-049 edited a file under the reconciler roots without re-issuing that component.","non_goals":["Do not rewrite the existing reconciler evidence record","Do not change any test or implementation; this is a measurement and a record"],"actor":"sol","input_refs":["V2-057","V2-019"],"input_hash":"64dc64abb073aabdd91586d0d913aa3f5d1ec46de677d7ef6a84536c16b62dbd","output_refs":["V2-057","ev-v2-057-reconciler-refresh"],"output_hash":"1aaa5c7d3aadc462c3349bc1423eaff35265876b90f7bfb1c7cd5be9fbe2903b","owner":"sol","next_owner":null,"retry_budget":{"max_attempts":2,"attempts_used":1,"remaining":1},"release_eligible":false,"transitions":[{"sequence":1,"at":"2026-08-24T23:46:28Z","from_status":null,"to_status":"queued","actor":"sol","input_refs":["V2-057","V2-019"],"input_hash":"64dc64abb073aabdd91586d0d913aa3f5d1ec46de677d7ef6a84536c16b62dbd","output_refs":["V2-057"],"output_hash":"abd60b4440d95905af0475c081a008f497bfac89be21457b9a1b834bcd0f8cf8","owner":"sol","next_owner":"sol","retry_budget":{"max_attempts":2,"attempts_used":0,"remaining":2},"reason":"the M4 gate is blocked only by a missing fresh reconciler entry: V2-049 edited internal/reconciler/failure_matrix_test.go and re-issued the domain evidence alone"},{"sequence":2,"at":"2026-08-24T23:47:16Z","from_status":"queued","to_status":"running","actor":"sol","input_refs":["V2-057","V2-019"],"input_hash":"64dc64abb073aabdd91586d0d913aa3f5d1ec46de677d7ef6a84536c16b62dbd","output_refs":["V2-057"],"output_hash":"abd60b4440d95905af0475c081a008f497bfac89be21457b9a1b834bcd0f8cf8","owner":"sol","next_owner":"sol","retry_budget":{"max_attempts":2,"attempts_used":1,"remaining":1},"reason":"the coordinator re-measures the reconciler component at the judging tree"},{"sequence":3,"at":"2026-08-24T23:47:16Z","from_status":"running","to_status":"complete","actor":"sol","input_refs":["V2-057","V2-019"],"input_hash":"64dc64abb073aabdd91586d0d913aa3f5d1ec46de677d7ef6a84536c16b62dbd","output_refs":["V2-057","ev-v2-057-reconciler-refresh"],"output_hash":"1aaa5c7d3aadc462c3349bc1423eaff35265876b90f7bfb1c7cd5be9fbe2903b","owner":"sol","next_owner":null,"retry_budget":{"max_attempts":2,"attempts_used":1,"remaining":1},"reason":"a passed reconciler entry now carries the key measured at the judging tree, added rather than rewritten so the earlier observation survives; the check target was re-run with -count=1 given explicitly because the target itself does not force it"}]}