{
  "schema_version": "v1",
  "id": "ts-v2-031",
  "kind": "canonical-task-state",
  "task_id": "V2-031",
  "status": "blocked",
  "dependencies": [
    "V2-030",
    "V2-029"
  ],
  "outcome": "Run two independent Runner instances in two containers on one host with injected clock skew, across at least two Repositories, and prove no duplicate Increment owner, no starvation under a single repository's failure storm, and cross-repository rollback convergence.",
  "non_goals": [
    "Do not add podman or any container runtime to devbox.json",
    "Do not block on the absence of a second physical machine; the two-machine first boot is an operations procedure, not a gate condition",
    "Do not cause side effects outside the dedicated sandbox repositories"
  ],
  "actor": "sol",
  "input_refs": [
    "V2-031",
    "V2-030",
    "V2-029"
  ],
  "input_hash": "3a9fe6ce3d605ff5434c591b4557edf030c65839d92bbb2ac1ced3df6939d881",
  "output_refs": [
    "V2-031"
  ],
  "output_hash": "f0af93449019f9217ca1adc550d13a200e79037ae102507ac940ae35e6a4a330",
  "owner": "luna",
  "next_owner": "luna",
  "block_reason": "V2-029",
  "retry_budget": {
    "max_attempts": 2,
    "attempts_used": 0,
    "remaining": 2
  },
  "release_eligible": false,
  "transitions": [
    {
      "sequence": 1,
      "at": "2026-08-24T10:32:20Z",
      "from_status": null,
      "to_status": "blocked",
      "actor": "sol",
      "input_refs": [
        "V2-031",
        "V2-030",
        "V2-029"
      ],
      "input_hash": "3a9fe6ce3d605ff5434c591b4557edf030c65839d92bbb2ac1ced3df6939d881",
      "output_refs": [
        "V2-031"
      ],
      "output_hash": "f0af93449019f9217ca1adc550d13a200e79037ae102507ac940ae35e6a4a330",
      "owner": "luna",
      "next_owner": "luna",
      "retry_budget": {
        "max_attempts": 2,
        "attempts_used": 0,
        "remaining": 2
      },
      "reason": "enqueued by Sol for the M7 live verification"
    }
  ]
}
