{"schema_version":"v1","id":"ts-v2-032","kind":"canonical-task-state","task_id":"V2-032","status":"blocked","dependencies":["V2-031"],"outcome":"Judge the M7 gate.","non_goals":["Do not accept multiple local processes as multi-machine evidence"],"actor":"sol","input_refs":["V2-032","V2-031"],"input_hash":"1833f3ffb25fc1b700bc49c2b9aa2842794ae1eae26efdedb33a0026302602b5","output_refs":["V2-032"],"output_hash":"0f8c26b2f11fc6b134fbbfa666d61205f6ced37f4285d511f16f631f798d90d6","owner":"sol","next_owner":"sol","block_reason":"V2-031","retry_budget":{"max_attempts":1,"attempts_used":0,"remaining":1},"release_eligible":false,"transitions":[{"sequence":1,"at":"2026-08-24T10:32:20Z","from_status":null,"to_status":"blocked","actor":"sol","input_refs":["V2-032","V2-031"],"input_hash":"1833f3ffb25fc1b700bc49c2b9aa2842794ae1eae26efdedb33a0026302602b5","output_refs":["V2-032"],"output_hash":"0f8c26b2f11fc6b134fbbfa666d61205f6ced37f4285d511f16f631f798d90d6","owner":"sol","next_owner":"sol","retry_budget":{"max_attempts":1,"attempts_used":0,"remaining":1},"reason":"enqueued by Sol as the M7 gate"}]}