{"schema_version":"v1","id":"ts-v2-059","kind":"canonical-task-state","task_id":"V2-059","status":"complete","dependencies":["V2-019"],"outcome":"Align the user-facing description of the pause modes with the measured behaviour: under any mode other than allow, no authoritative effect is constructed, so pause stops more than new intake.","non_goals":["Do not weaken the domain invariant that effects are constructed only under allow","Do not change internal/domain"],"actor":"luna","input_refs":["wo-v2-059","dp-v2-059"],"input_hash":"4d68486b310b12a823afebdf0becab3343c037b30051766d91a899098de2edd1","output_refs":["ev-v2-059-docs","ev-v2-059-application"],"output_hash":"a6a63209ba12680de74efaa5c9672a976bbbf4addef13105394cf20e7279fed4","owner":"luna","next_owner":null,"retry_budget":{"max_attempts":2,"attempts_used":1,"remaining":1},"release_eligible":false,"transitions":[{"sequence":1,"at":"2026-08-24T23:46:28Z","from_status":null,"to_status":"queued","actor":"sol","input_refs":["V2-059","V2-019"],"input_hash":"afd964fce38f5978ce186f753fa765d54d88841123cfaea2f940759166a7c9a1","output_refs":["V2-059"],"output_hash":"19438de74800cc153ad09350c4c5c0dd8ff1679ca9d7aa3755016418e621f129","owner":"terra","next_owner":"terra","retry_budget":{"max_attempts":2,"attempts_used":0,"remaining":2},"reason":"the measured 56-cell matrix shows pause-intake also denies claim, result acceptance and outbox delivery because effect construction requires the allow mode, which is safe-side but broader than the product definition states"},{"sequence":2,"at":"2026-08-25T01:47:33Z","from_status":"queued","to_status":"running","actor":"luna","input_refs":["wo-v2-059","dp-v2-059"],"input_hash":"4d68486b310b12a823afebdf0becab3343c037b30051766d91a899098de2edd1","output_refs":["V2-059"],"output_hash":"19438de74800cc153ad09350c4c5c0dd8ff1679ca9d7aa3755016418e621f129","owner":"luna","next_owner":"luna","retry_budget":{"max_attempts":2,"attempts_used":1,"remaining":1},"reason":"wo-v2-059\u306b\u57fa\u3065\u304dpause mode\u306e\u88fd\u54c1\u5b9a\u7fa9\u3092\u5b9f\u6e2c\u3078\u5408\u308f\u305b\u308b\u4f5c\u696d\u306b\u7740\u624b\u3002domain\u306e\u5b9f\u88c5\u306f\u5909\u66f4\u3057\u306a\u3044"},{"sequence":3,"at":"2026-08-25T01:58:31Z","from_status":"running","to_status":"complete","actor":"luna","input_refs":["wo-v2-059","dp-v2-059"],"input_hash":"4d68486b310b12a823afebdf0becab3343c037b30051766d91a899098de2edd1","output_refs":["ev-v2-059-docs","ev-v2-059-application"],"output_hash":"a6a63209ba12680de74efaa5c9672a976bbbf4addef13105394cf20e7279fed4","owner":"luna","next_owner":null,"retry_budget":{"max_attempts":2,"attempts_used":1,"remaining":1},"reason":"definition.md \u00a77\u306epause\u5b9a\u7fa9\u3092\u5b9f\u6e2c\u3078\u5408\u308f\u305b\u3001TestStopModeByKindMatrix\u306bper-mode\u8a31\u53efcell\u6570\u306eassertion\u3092\u8ffd\u52a0\u3057\u3066\u6587\u66f8\u306e\u4e3b\u5f35\u3092test\u306b\u56fa\u5b9a\u3057\u305f\u3002V2-019\u306e\u6563\u6587\u304c\u8aa4\u3063\u3066\u3044\u305f\uff08pause-intake\u306f2/8\u3067\u306f\u306a\u304f1/8\u3001\u5408\u8a08\u306f13/56\u3067\u306f\u306a\u304f12/56\uff09\u3053\u3068\u3092\u5b9f\u6e2c\u3067\u78ba\u8a8d\u3002domain\u306e\u5b9f\u88c5\u306f\u672a\u5909\u66f4\u3067L3\u9589\u5305\u306f\u4e0d\u5909"}]}