{"schema_version":"v1","id":"ts-v2-068","kind":"canonical-task-state","task_id":"V2-068","status":"complete","dependencies":["V2-030","V2-073"],"outcome":"Connect the scheduler to the running system: a control mode that sets a concurrency limit, and a queue summary that reports allocation, waiting reason and exhaustion, so shared resource allocation becomes observable.","non_goals":["Do not re-design the scheduler's decision rules here","Do not report an allocation the scheduler did not decide","Do not let a limit change retroactively invalidate a granted claim"],"actor":"luna","input_refs":["V2-030","V2-068"],"input_hash":"7676e22654007c718f95812cdf8be42930fc80d9da5bdbe17239500bd84a1c98","output_refs":["ev-v2-068-application","ev-v2-068-api"],"output_hash":"9d5489e57ad214436c3c8a34d2635b6fa1ebdd65efa97362d230bcb52c33590e","owner":"luna","next_owner":null,"retry_budget":{"max_attempts":2,"attempts_used":1,"remaining":1},"release_eligible":false,"transitions":[{"sequence":1,"at":"2026-08-25T02:20:00Z","from_status":null,"to_status":"queued","actor":"sol","input_refs":["V2-030","V2-068"],"input_hash":"7676e22654007c718f95812cdf8be42930fc80d9da5bdbe17239500bd84a1c98","output_refs":["V2-068"],"output_hash":"231e4dfac384fd36f84a35242963a3bc3e6592d7543ecc5803948f071cf3bbd9","owner":"terra","next_owner":"terra","retry_budget":{"max_attempts":2,"attempts_used":0,"remaining":2},"reason":"the M5 dogfood design measured that nine of the twelve declared capabilities cannot be exercised and that five of them have no implementation at all; this task owns escalation E22-5, where internal/scheduler is imported by no package outside itself, no control mode sets a concurrency limit, and the queue summary reports no allocation, waiting reason or exhaustion, so the declared capability cannot be observed"},{"sequence":2,"at":"2026-08-25T03:40:02Z","from_status":"queued","to_status":"blocked","actor":"sol","input_refs":["V2-030","V2-068"],"input_hash":"7676e22654007c718f95812cdf8be42930fc80d9da5bdbe17239500bd84a1c98","output_refs":["V2-068"],"output_hash":"231e4dfac384fd36f84a35242963a3bc3e6592d7543ecc5803948f071cf3bbd9","owner":"luna","next_owner":"luna","retry_budget":{"max_attempts":2,"attempts_used":0,"remaining":2},"reason":"the five surface tasks were each designed to widen the same six files (the api handler, the application ports, service and read models, the openapi document, the owner console and both stores), so they cannot run at once: three concurrent writers to one file leave the coordinator resolving a textual conflict by hand, and an evidence key measured on a tree that never becomes a commit is the defect that ev-v2-013-infra-plan already recorded. They are serialised, each branching from the tip the previous one landed on"},{"sequence":3,"at":"2026-08-25T13:20:00Z","from_status":"blocked","to_status":"queued","actor":"sol","input_refs":["V2-030","V2-068"],"input_hash":"7676e22654007c718f95812cdf8be42930fc80d9da5bdbe17239500bd84a1c98","output_refs":["V2-068"],"output_hash":"231e4dfac384fd36f84a35242963a3bc3e6592d7543ecc5803948f071cf3bbd9","owner":"luna","next_owner":"luna","retry_budget":{"max_attempts":2,"attempts_used":0,"remaining":2},"reason":"every task this one depends on is complete, so the block has cleared"},{"sequence":4,"at":"2026-08-25T10:34:47Z","from_status":"queued","to_status":"running","actor":"luna","input_refs":["V2-030","V2-068"],"input_hash":"7676e22654007c718f95812cdf8be42930fc80d9da5bdbe17239500bd84a1c98","output_refs":["V2-068"],"output_hash":"231e4dfac384fd36f84a35242963a3bc3e6592d7543ecc5803948f071cf3bbd9","owner":"luna","next_owner":"luna","retry_budget":{"max_attempts":2,"attempts_used":1,"remaining":1},"reason":"scheduler\u3092\u7a3c\u50cd\u7cfb\u3078\u914d\u7dda\u3059\u308b\u4f5c\u696d\u306b\u7740\u624b"},{"sequence":5,"at":"2026-08-25T10:34:48Z","from_status":"running","to_status":"complete","actor":"luna","input_refs":["V2-030","V2-068"],"input_hash":"7676e22654007c718f95812cdf8be42930fc80d9da5bdbe17239500bd84a1c98","output_refs":["ev-v2-068-application","ev-v2-068-api"],"output_hash":"9d5489e57ad214436c3c8a34d2635b6fa1ebdd65efa97362d230bcb52c33590e","owner":"luna","next_owner":null,"retry_budget":{"max_attempts":2,"attempts_used":1,"remaining":1},"reason":"internal/application\u304b\u3089internal/scheduler\u3078\u306eedge\u3092\u5ba3\u8a00\u3068\u5b9fimport\u306e\u540c\u4e00commit\u3067\u4f5c\u308a\u3001queue summary\u304c\u540c\u4e00transaction\u5185\u3067Decide\u3092\u547c\u3073Apply\u306f\u547c\u3070\u306a\u3044\u5f62\u3067\u914d\u5206\u30fb\u5f85\u6a5f\u7406\u7531\u30fb\u67af\u6e07\u3092\u5831\u544a\u3059\u308b\u3088\u3046\u306b\u3057\u305f\u3002\u4e0a\u9650\u306fControl Intent revision keyed\u306eside table\u3067ControlMode\u306f7\u5024\u4e0d\u5909\u3002\u4e0a\u9650\u3092\u4e0b\u3052\u3066\u3082\u5168lease\u306efencing token\u307e\u3067byte\u4e0d\u5909\u30fbclaim multiset\u4e0d\u5909\u30fb\u65b0\u898f\u5272\u5f530\u3067\u3001\u4e0a\u9650\u3092\u623b\u3059\u3068\u4fee\u5fa9\u624b\u9806\u30bc\u30ed\u3067\u6b21\u306eread\u306b\u5272\u5f53\u304c\u51fa\u308b\u9006\u5411\u304dnegative control\u3082\u7f6e\u3044\u305f\u3002L3\u9589\u5305\u306e\u4e0d\u5909\u30923\u901a\u308a\u3067\u793a\u3057\u305f\uff08domain\u306ediff\u30bc\u30ed\u30fbstop matrix\u306ecell\u6570\u3068file sha256\u4e00\u81f4\u30fb\u4e0a\u9650\u304cpermit\u7d4c\u8def\u306efield\u540d\u306b\u73fe\u308c\u305apermit\u5fdc\u7b54\u304cbyte\u540c\u4e00\uff09\u3002write 0\u306fport method set\u3092reflection\u3067\u8d70\u67fb\u3057\u306621\u672c\u3059\u3079\u3066\u304cspy\u3067\u8986\u308f\u308c\u3066\u3044\u308b\u3053\u3068\u307e\u3067\u6a5f\u68b0\u7684\u306b\u4fdd\u8a3c\u3057\u305f\u3002git checkout -- \u30921\u56de\u4f7f\u3063\u305f\u3053\u3068\u3092\u81ea\u5df1\u7533\u544a\u3057\u3066\u3044\u308b"}]}